[
  {
    "id": "user-memo-clock-20261017",
    "title": "提供メモに基づく仮時刻と場面順（2026-10-17）",
    "url": null,
    "source_type": "user_hypothesis",
    "checked_at": "2026-10-17",
    "supports": "E374-005は3日目01:30頃、E375-007は3日目07:30頃、E375-009は3日目07:00頃というユーザー指定の仮配置。",
    "notes": "いずれも原作の時計表示ではなく、頃？付きで表示する。第373話の能力継承をハンゾーの1012号室での足止めより前に置くため、E373-006は2日目13:08頃へ編集上の仮配置とする。第373話写真9→10、第375話写真6〜8→9〜10の描写順を別途確認した。"
  },
  {
    "id": "user-approximate-coincidence-20261017",
    "title": "同じ仮時刻への配置と同時刻確定の区別（2026-10-17ユーザー指定）",
    "url": null,
    "source_type": "user_hypothesis",
    "checked_at": "2026-10-17",
    "supports": "定時報告と退室を、ともに頃？付きの12:45へ仮配置。同じ表示時刻でも原作での同時刻確定や同時場面の認定を意味しない。",
    "notes": "E359-005は発見の仮13:00の15分前を維持。E359-006は仮12:50から12:45へ変更。simultaneous_withは追加しない。"
  },
  {
    "id": "user-scene-transition-374-20261016",
    "title": "第374話の場面転換に置く時間経過（2026-10-16ユーザー指定）",
    "url": null,
    "source_type": "user_hypothesis",
    "supports": "ウェルゲーとの通話は第373話末尾のハンゾーとクラピカの場面から続く時間帯とし、船のカット・出航37時間30分の経過表示からフウゲツの深夜の場面へ大きく時間が経過するというユーザーの読解。",
    "checked_at": "2026-10-16",
    "notes": "E374-001を2日目13:25頃に仮配置。13:25はE373-007の仮13:20に続く表示順用の値。フウゲツのE374-002の3日目01:27は原作の時計表示を維持。経過表示の逆算01:30は通話の時刻に流用せず、01:27との3分差も改変しない。"
  },
  {"id":"togashi-x-20241217-p09","title":"冨樫義博 公式X：第9王子陣営の人物設定表（2024年12月17日 01:41 JST）","url":"https://x.com/Un4v5s8bgsVk9Xp/status/1868697918624219482","media_url":"https://pbs.twimg.com/media/Ge7y2iObwAIBkxu?format=jpg&name=large","source_type":"author_official_x","verification_status":"primary_image_checked","checked_at":"2026-10-09","supports":"作者設定表の氏名・顔・私設兵14名欄・兵隊長表記。設定表としての一次資料。","notes":"公式アカウントの投稿本文・日時・添付原画像を直接確認。原作の登場話、最新の生死、念能力、現在地を確定する資料ではない。スミドリの名前は同日01:45の訂正版を優先。設定表の14名を原作人数表への増員として加算しない。"},
  {"id":"togashi-x-20241217-p09-correction","title":"冨樫義博 公式X：第9王子陣営設定表の訂正（2024年12月17日 01:45 JST）","url":"https://x.com/Un4v5s8bgsVk9Xp/status/1868698940058845479","media_url":"https://pbs.twimg.com/media/Ge7zyABa8AEbGxW?format=jpg&name=large","source_type":"author_official_x","verification_status":"primary_image_checked","checked_at":"2026-10-09","supports":"スドミリの取り消しとスミドリへの訂正。","notes":"投稿本文はW。訂正版の原画像を直接確認。別陣営の設定表ではなく、同じ第9王子陣営表の訂正版。訂正前表記を別人として登録しない。"},
  {
    "id": "official-viz-chapters",
    "title": "VIZ - Hunter x Hunter Chapters",
    "url": "https://www.viz.com/shonenjump/chapters/hunter-x-hunter",
    "source_type": "official",
    "supports": "公式公開話数の確認",
    "checked_at": "2026-08-03",
    "notes": "確認時点で第414話まで公開"
  },
  {
    "id": "welge-secondary-check",
    "title": "王位継承戦の警護人一覧",
    "url": "https://hunter-hunter-battle-royale.firebaseapp.com/",
    "source_type": "secondary",
    "supports": "ウェルゲーが第7王妃所属兵で第13王子警護兵隊長であること",
    "checked_at": "2026-08-03",
    "notes": "第374話の原作確認を優先する"
  },
  {
    "id": "user-original-ch406-410",
    "title": "ユーザー提供の原作画像 第406〜410話",
    "url": null,
    "source_type": "original_user_provided",
    "supports": "第406〜410話の人物・出来事・日時・場所・状態変化",
    "checked_at": "2026-08-03",
    "notes": "全50枚を確認。画像自体はサイトおよびリポジトリへ保存・転載しない。提供された画像データを最優先の根拠として扱う"
  },
  {
    "id": "user-notes-ch411-415",
    "title": "ユーザー原作確認メモ 第411〜415話",
    "url": null,
    "source_type": "user_transcription",
    "supports": "第411〜415話の人物・出来事・日時・場所",
    "checked_at": "2026-08-03",
    "notes": "本誌には誤字、確認メモには転記ミスの可能性がある。提供画像、410話以前の単行本情報と矛盾する場合はそちらを優先。ページ画像による再照合待ち"
  },
  {
    "id": "user-original-ch411",
    "title": "ユーザー提供の原作画像 第411話",
    "url": null,
    "source_type": "original_user_provided",
    "supports": "12日目（木曜日）AM8:00 司法省内の表示と葬列の予定、バルサミルコの報告、サラヘルのメイド変装と第14王子への呪詛の見込み（約1週間／5日）と後任カコの指名、第2回講習会（現参加者18名、入門9名・初級9名）と参加者の肩書き表示、スラッカの入門クラス参加申し出、クラピカによる継承戦の『まつり』と制約の説明（B・W航行中が期限、残り約一か月半）、第14王子は継承戦の資格を有していないとの発表",
    "checked_at": "2026-10-10",
    "notes": "雑誌掲載の写真11枚（写真1〜3・5・6は縦位置の1ページ、4・7〜11は見開き）を照合。写真11左に『No.411 おわり』。扉・題名・印刷ページ番号は写真で確認できない（題名は判読不明）。日付・時刻の表示は写真1の『12日目（木曜日） AM8:00 司法省内』のみ。写真11右の砂時計のコマに『0:01:18:13:46:29』の数字表示があるが、何の残り時間かは画像に説明がない。欠落ページの有無は断定しない。 2026-10-10にClaude Codeが画像ごとの場面対応を再照合。画像本体は公開リポジトリに含めない。"
  },
  {
    "id": "user-original-ch412",
    "title": "ユーザー提供の原作画像 第412話",
    "url": null,
    "source_type": "original_user_provided",
    "supports": "1014号室でクラピカが講習を10時開始に変更する場面（特殊戒厳令発令5時間前）、約48時間前の回想としてのオイトの告白（本物の第14王子＝オイトの娘、船内の乳児＝オイトの妹の息子、ホテルでの入れ替え、娘は妹に預け場所は知らない）、ビルの発音の気付き、シマヌの名前、AM10:00の講習再開と第2王妃兵のみの離脱、クラピカの内心（呪いと詛贅者）、クレアパトロとビヨンドの面会（裁判の結果、旧知の関係）",
    "checked_at": "2026-10-10",
    "notes": "雑誌掲載の写真10枚（写真1は扉の見開き、2〜10は見開き）を照合。扉に『No.412◆』（題名は写真の端で見切れて判読不明）、写真10に『No.412 おわり』。印刷ページ番号は写真4右の『352』のみ判読。日付表示はない。時刻表示は『特殊戒厳令発令 5時間前』（写真1）、『特殊戒厳令発令 約48時間前』（写真3。回想場面の表示）、時計『AM10:00』（写真7左）。欠落ページの有無は断定しない。 2026-10-10にClaude Codeが画像ごとの場面対応を再照合。画像本体は公開リポジトリに含めない。"
  },
  {
    "id": "user-original-ch413",
    "title": "ユーザー提供の原作画像 第413話",
    "url": null,
    "source_type": "original_user_provided",
    "supports": "第9王子の棺と『命の火（たいまつ）』をめぐる国王・ヌグイの会話、ベンジャミンによる人格入れ替えの推理、ベンジャミンのTSK-17様の症状と自己推理、ヒュリコフによるTSK-17噴霧の告白（第1王妃の要求・ビヨンドの呪い）、ヒュリコフの能力の作中解説、ベンジャミンの14時15分特殊戒厳令発令の通達と王子粛清計画、特殊戒厳令発令30分前・15分前の表示",
    "checked_at": "2026-10-10",
    "notes": "雑誌掲載の写真10枚（見開き中心）を照合。扉に『No.413◆忠◯』（2字目判読不明）。印刷ページ番号は写真7右ページの360のみ判読。写真1〜10が第413話の連続した全ページかは扉と末尾の『No413』表記から推定するが、欠落の有無は断定しない。TSK-17の潜伏期間は画像内ではベンジャミンの独白で『およそ6時間』。旧記録の『1〜6時間』（巻末コメント由来）は今回の画像では確認できない。日付（12日目）は画像内に明示がない。 2026-10-10にClaude Codeが画像ごとの場面対応を再照合。画像本体は公開リポジトリに含めない。"
  },
  {
    "id": "user-original-ch414",
    "title": "ユーザー提供の原作画像 第414話「仲間」",
    "url": null,
    "source_type": "original_user_provided",
    "supports": "1007号室の区域でのカンジドルによる刺殺と正当防衛の主張、ルズールスの無抵抗命令と薬の処分命令、ウショウヒとチヤマシの1009号室突入準備とチヤマシの能力の作中解説、1014号室での第14王子入れ換えの経緯（オイトの『娘』、クラピカの『妹の息子』）、ビルの立場表明、ビヨンドの呪いへの対応方針、王子の捜索をH協会に依頼する方針、ヤマト国経由の連絡手段、『継承戦終了まで残り49日』の表示",
    "checked_at": "2026-10-10",
    "notes": "雑誌掲載の写真10枚（写真1は扉、2〜10は見開き）を照合。扉に『No.414◆仲間』、写真10に『No414』。印刷ページ番号は写真7右の『37』に続く数字が見切れて判読不明。日付・時計時刻の表示はなく、時期の表示は『継承戦終了まで残り49日』のみ。『発令15分前』の表示は第414話の画像にない（第413話末の表示）。欠落ページの有無は断定しない。 2026-10-10にClaude Codeが画像ごとの場面対応を再照合。画像本体は公開リポジトリに含めない。"
  },
  {
    "id": "user-original-ch415",
    "title": "ユーザー提供の原作画像 第415話",
    "url": null,
    "source_type": "original_user_provided",
    "supports": "出航2か月前のヒュリコフによる呪いの発見（本人の能力『鋼の錬金術師』の画面表示、解読365日・具現化700日）とビヨンドとの通話（ヒュリコフの死で発動し『ある王子』を呪い殺す呪い、壺中卵の儀が引き鉄、第1王子以外の全王子を殺せという忠告）、出航11日目水曜PM1:50（特殊戒厳令25分前）表示のクラピカと第8王妃のヨロズヤ相談、特殊戒厳令発令の放送と各居住区の反応、1007号室付近での第7王子不在の判明、1011号室の王妃の退去、PM2:00表示のビスケットの籠城判断、1014号室の発令20分後の恩赦伝達",
    "checked_at": "2026-10-10",
    "notes": "雑誌掲載の写真10枚（写真1は扉、写真2〜10は見開き）を照合。扉に『No.415◆』とあるが題名は判読不明。印刷ページ番号は392（写真4右）・397（写真6左）・399（写真7左）が読める。写真10左下に『No415／おわり』。日時の表示は画像の表記どおりに記録した：『出航 2か月前』（写真1）、『出航11日目 水曜 PM1:50 特殊戒厳令25分前』（写真5左）、『1003号室（念空間） PM2:00 特殊戒厳令』（写真10右。描かれた扉の表示板は1013）、『1014号室 特殊戒厳令発令より 20分経過』（写真10左）。11日目・水曜の表記は第416話の『12日目 木曜日 PM2:15 特殊戒厳令 発令』と両立しない。 2026-10-10にClaude Codeが画像ごとの場面対応を再照合。画像本体は公開リポジトリに含めない。"
  },
  {
    "id": "user-original-ch416",
    "title": "ユーザー提供の原作画像 第416話「発令」",
    "url": null,
    "source_type": "original_user_provided",
    "supports": "特殊戒厳令発令の放送と一般区画の制圧、12日目木曜日PM2:15の発令表示、ベンジャミンの独白（発症から死亡まで12時間・昏睡2時間・残り10時間）、ベンジャミンとカミーラの対峙（迎撃型能力への言及、モスワナの自死と呪殺の成就、カミーラの3か月の冬眠）、1004号室への突入、ツェリードニヒがサルコフに偽の死を予告する場面、1014号室の受講者の連行命令、ベンジャミンがツェリードニヒを至近距離で撃つ場面",
    "checked_at": "2026-10-10",
    "notes": "雑誌掲載の写真10枚（写真1は単ページ、写真2〜10は見開き）を照合。扉に『No.416◆発令』。印刷ページ番号は判読できず。写真10左下に『No416』。日時の表示は写真2左の『12日目 木曜日 PM2:15 特殊戒厳令 発令』のみ。ヒュリコフはこの話に登場しない。 2026-10-10にClaude Codeが画像ごとの場面対応を再照合。画像本体は公開リポジトリに含めない。"
  },
  {
    "id": "user-original-ch417",
    "title": "ユーザー提供の原作画像 第417話「有事」",
    "url": null,
    "source_type": "original_user_provided",
    "supports": "ベンジャミンによる第4王子の銃撃と私刑宣言、サルコフの偽（フェイク）か現実かの疑い、サルコフとダンジンの送還命令、1001号室での報告（第3・第7王子の発令前逃走、コベントバ、バルサミルコ）、ツベッパ・タイソンとの会談とブーツの噴霧描写、第3層の制圧完了と兵の呪いの印、ベンジャミンのTSK感染と余命半日の発言、第9王子の入れ替わり先の捜索とコインの報告、シュウ＝ウ・シャ＝ア組長の拘束命令、緊急事態法と王子全滅計画、第1王子の守護霊獣の能力〝流浪の民〟の解説、第1王妃の奸計の推理と『究極の2択』",
    "checked_at": "2026-10-10",
    "notes": "雑誌掲載の写真10枚（写真1は扉、写真2〜10は見開き）を照合。扉に『No.417◆有事』。印刷ページ番号は426（写真2右）・437（写真7左）・438（写真8右下）が読める。写真10左下に『No417』。日付・時刻の表示はない。ヒュリコフ本人は登場せず、ベンジャミンの台詞・独白で言及されるだけ。 2026-10-10にClaude Codeが画像ごとの場面対応を再照合。画像本体は公開リポジトリに含めない。"
  },
  {
    "id": "user-original-ch418",
    "title": "ユーザー提供の原作画像 第418話「仮定」",
    "url": null,
    "source_type": "original_user_provided",
    "supports": "ツェリードニヒの『刹那の10秒』の確定ルールと範囲仮説、サルコフとの検証、特殊戒厳令発令と第1王子の突入・発砲、絶の継続による死の偽装と念獣のバッテリー、遺言の読み上げと国王軍の通達、テータの接触、脱出開始とルート推理",
    "checked_at": "2026-10-10",
    "notes": "雑誌掲載の写真10枚（写真1は扉、2〜10は見開き）を照合。扉に『No.418◆仮定』、写真10に『No418 おわり』。印刷ページ番号は258・260・263・267・271が読める。日付・時計時刻の表示はない。部屋番号は第418話の画像内では読めない。 2026-10-10にClaude Codeが画像ごとの場面対応を再照合。画像本体は公開リポジトリに含めない。"
  },
  {
    "id": "user-original-ch419",
    "title": "ユーザー提供の原作画像 第419話「実践」",
    "url": null,
    "source_type": "original_user_provided",
    "supports": "ツェリードニヒの1004号室からの脱出、『刹那の10秒』の半径約36m・リセット条件・連続使用条件・外から入った者が影響を受けないことの確認、国王軍兵との銃撃戦と死傷、国王軍の捜索指示、カジノエリア侵入と第1層シャットダウンの放送",
    "checked_at": "2026-10-10",
    "notes": "雑誌掲載の写真10枚（写真1は扉、2〜10は見開き）を照合。扉に『No.419◆実践』、写真10に『No419』。印刷ページ番号は写真10右の364のみ判読。日付・時計時刻の表示はない。 2026-10-10にClaude Codeが画像ごとの場面対応を再照合。画像本体は公開リポジトリに含めない。"
  },
  {
    "id": "user-original-ch373",
    "title": "ユーザー提供の原作画像 第373話「継承」",
    "url": null,
    "source_type": "original_user_provided",
    "supports": "ムッセによるカミーラ射殺と迎撃型の念獣〝百万回生きた猫（ネコノナマエ）〟によるムッセ死亡・カミーラ蘇生、カミーラの第1王子居室への単独襲撃とベンジャミン私設兵の銃撃、ベンジャミンへの銃撃、白い上着の私設兵による腕の骨折と拘束・収監、ムッセの〝裏窓の鳥（シークレットウインドウ）〟の説明と〝星を継ぐもの（ベンジャミンバトン）〟によるムッセ・ビンセントの能力の継承、1012号室の閉鎖、第13王子一行の消失の1014号室への伝達とウェルゲーからの電話",
    "checked_at": "2026-10-10",
    "notes": "画像10枚（写真1は単ページ、写真2〜10は見開きで右ページが先）。写真1に『No.373◆継承』（印刷49ページ）。印刷ページ番号は49・51（写真2左）・52（写真3右）・53（写真3左）・54（写真4右）・58（写真6右）を判読。確認範囲は49〜67ページ。写真7左にベンジャミンの台詞『まだ2日目の午後だというのに』がある。キャプションによる時刻表示はない。 2026-10-10にClaude Codeが画像ごとの場面対応を再照合。画像本体は公開リポジトリに含めない。"
  },
  {
    "id": "user-original-ch375",
    "title": "ユーザー提供の原作画像 第375話「説得」",
    "url": null,
    "source_type": "original_user_provided",